{
  "manifest_version": "6.0-mvp-1",
  "source_template": {
    "file": "assets/templates/base-template-23p-capability-source.pptx",
    "sha256": "ef26f71c314d3286a21c04d2ac615570e2efedf8cf6a6ac1b0c797aac0712107",
    "slide_count": 23,
    "inheritance_model": "slide-local objects; empty master and layout"
  },
  "selection_policy": "visual_concept_then_required_capabilities_then_template_match",
  "templates": [
    {
      "template_id": "T01", "source_slide": 1, "layout_role": "opening thesis with edge visual",
      "communication_intents": ["open with one thesis", "establish visual identity"],
      "supported_semantic_relationships": ["single claim over supporting subtitle"],
      "supported_visual_actions": ["occupy_and_anchor", "counterweight_at_edge"],
      "hero_object_capabilities": ["overscale_statement", "cropped_edge_asset"],
      "scale_capabilities": {"supports_oversized_text": true, "supports_oversized_number": false, "supports_dominant_visual": true},
      "spatial_capabilities": {"supports_asymmetry": true, "supports_area_encoding": false, "supports_overlap": true, "supports_fusion": false, "supports_partition": false, "supports_sequence": false},
      "color_energy_range": ["low", "medium"], "data_capabilities": [],
      "editable_regions": ["large upper-left title", "lower-left subtitle"], "fixed_regions": ["bottom-left SVG edge motif", "bottom-right page number"],
      "renderer_requirements": ["preserve title-subtitle hierarchy", "treat SVG as replaceable whole image only"],
      "recommended_use": ["short opening thesis", "title-as-object"], "avoid_when": ["dense evidence", "multi-part comparison", "ratio mapping"],
      "failure_risks": ["edge motif can become decorative", "long title destroys the single-object silhouette"], "confidence": 0.96, "evidence_status": "COMPUTED_AND_VISUALLY_CONFIRMED"
    },
    {
      "template_id": "T02", "source_slide": 2, "layout_role": "editorial summary with one KPI",
      "communication_intents": ["state a claim and attach one proof", "summarize with a right-side KPI"],
      "supported_semantic_relationships": ["claim supported by one metric", "summary plus proof"],
      "supported_visual_actions": ["anchor_claim_then_prove"], "hero_object_capabilities": ["single_kpi_support"],
      "scale_capabilities": {"supports_oversized_text": false, "supports_oversized_number": false, "supports_dominant_visual": false},
      "spatial_capabilities": {"supports_asymmetry": true, "supports_area_encoding": false, "supports_overlap": false, "supports_fusion": false, "supports_partition": true, "supports_sequence": false},
      "color_energy_range": ["low", "medium_low"], "data_capabilities": ["one isolated metric without scale comparison"],
      "editable_regions": ["left title and body", "right KPI card"], "fixed_regions": ["top-right SVG motif", "bottom-right page number"],
      "renderer_requirements": ["keep KPI subordinate to the claim", "do not interpret card area as metric magnitude"],
      "recommended_use": ["executive summary with one proof"], "avoid_when": ["multiple metrics", "Hero Object required", "proportional comparison"],
      "failure_risks": ["KPI card may read as generic dashboard UI"], "confidence": 0.94, "evidence_status": "COMPUTED_AND_VISUALLY_CONFIRMED"
    },
    {
      "template_id": "T03", "source_slide": 3, "layout_role": "dark equal-peer metric wall",
      "communication_intents": ["scan five comparable facts", "create a compact evidence field"],
      "supported_semantic_relationships": ["five equal-status metrics"],
      "supported_visual_actions": ["scan_equal_peers"], "hero_object_capabilities": [],
      "scale_capabilities": {"supports_oversized_text": false, "supports_oversized_number": false, "supports_dominant_visual": false},
      "spatial_capabilities": {"supports_asymmetry": false, "supports_area_encoding": false, "supports_overlap": false, "supports_fusion": false, "supports_partition": true, "supports_sequence": false},
      "color_energy_range": ["medium", "high"], "data_capabilities": ["five equal-status KPI cells", "mixed number formats"],
      "editable_regions": ["title", "five metric cards"], "fixed_regions": ["top gradient stripe", "page number"],
      "renderer_requirements": ["use only for semantically equal peers", "keep one concise label per metric"],
      "recommended_use": ["five-fact overview"], "avoid_when": ["one metric must dominate", "weights differ", "causal or sequential relation"],
      "failure_risks": ["multiple large numbers create no single focal point", "equal card widths falsely imply equal weight"], "confidence": 0.98, "evidence_status": "COMPUTED_AND_VISUALLY_CONFIRMED"
    },
    {
      "template_id": "T04", "source_slide": 4, "layout_role": "quiet narrative context",
      "communication_intents": ["explain one context", "create a breathing page"],
      "supported_semantic_relationships": ["claim followed by explanation"],
      "supported_visual_actions": ["state_and_pause", "edge_counterweight"], "hero_object_capabilities": ["headline_as_primary_read"],
      "scale_capabilities": {"supports_oversized_text": false, "supports_oversized_number": false, "supports_dominant_visual": false},
      "spatial_capabilities": {"supports_asymmetry": true, "supports_area_encoding": false, "supports_overlap": false, "supports_fusion": false, "supports_partition": false, "supports_sequence": false},
      "color_energy_range": ["low", "medium_low"], "data_capabilities": [],
      "editable_regions": ["upper-left title and body"], "fixed_regions": ["bottom-right SVG motif", "page number"],
      "renderer_requirements": ["retain low density", "do not fill open right field with unrelated decoration"],
      "recommended_use": ["short context or implication"], "avoid_when": ["strong visual action", "data proof", "multiple concepts"],
      "failure_risks": ["whitespace can become unsupported emptiness"], "confidence": 0.95, "evidence_status": "COMPUTED_AND_VISUALLY_CONFIRMED"
    },
    {
      "template_id": "T05", "source_slide": 5, "layout_role": "one broad context field plus five equal subfields",
      "communication_intents": ["frame a method and enumerate five dimensions"],
      "supported_semantic_relationships": ["one context governing five equal subdomains"],
      "supported_visual_actions": ["frame_then_enumerate"], "hero_object_capabilities": ["broad_context_field"],
      "scale_capabilities": {"supports_oversized_text": false, "supports_oversized_number": false, "supports_dominant_visual": false},
      "spatial_capabilities": {"supports_asymmetry": true, "supports_area_encoding": false, "supports_overlap": false, "supports_fusion": false, "supports_partition": true, "supports_sequence": true},
      "color_energy_range": ["low", "medium_low"], "data_capabilities": ["five numbered qualitative fields"],
      "editable_regions": ["large left context card", "five right cards"], "fixed_regions": ["page number"],
      "renderer_requirements": ["preserve the one-to-five hierarchy", "numbers are labels, not magnitudes"],
      "recommended_use": ["methodology scope", "domain overview"], "avoid_when": ["five items have unequal importance", "continuous process", "ratio mapping"],
      "failure_risks": ["small cards falsely equalize importance", "card density can become UI-like"], "confidence": 0.96, "evidence_status": "COMPUTED_AND_VISUALLY_CONFIRMED"
    },
    {
      "template_id": "T06", "source_slide": 6, "layout_role": "navigation sequence with oversized label",
      "communication_intents": ["orient a section sequence", "show six ordered destinations"],
      "supported_semantic_relationships": ["ordered navigation list"],
      "supported_visual_actions": ["orient_then_scan", "counterweight_at_edge"], "hero_object_capabilities": ["overscale_section_label"],
      "scale_capabilities": {"supports_oversized_text": true, "supports_oversized_number": false, "supports_dominant_visual": true},
      "spatial_capabilities": {"supports_asymmetry": true, "supports_area_encoding": false, "supports_overlap": false, "supports_fusion": false, "supports_partition": true, "supports_sequence": true},
      "color_energy_range": ["low", "medium"], "data_capabilities": [],
      "editable_regions": ["large left title", "right six-item list"], "fixed_regions": ["top gradient rule", "bottom-left SVG motif", "page number"],
      "renderer_requirements": ["keep items concise", "use list order only when chronology or navigation is real"],
      "recommended_use": ["agenda", "chapter orientation"], "avoid_when": ["process transformation", "evidence comparison", "weighted steps"],
      "failure_risks": ["list can be mistaken for process", "decorative stripe may carry no meaning"], "confidence": 0.97, "evidence_status": "COMPUTED_AND_VISUALLY_CONFIRMED"
    },
    {
      "template_id": "T07", "source_slide": 7, "layout_role": "full-field chapter transition",
      "communication_intents": ["reset the narrative", "create a chromatic landmark"],
      "supported_semantic_relationships": ["chapter identity over optional subtitle"],
      "supported_visual_actions": ["occupy_and_anchor", "full_field_transition"], "hero_object_capabilities": ["overscale_statement", "full_field_color_atmosphere"],
      "scale_capabilities": {"supports_oversized_text": true, "supports_oversized_number": false, "supports_dominant_visual": true},
      "spatial_capabilities": {"supports_asymmetry": true, "supports_area_encoding": false, "supports_overlap": true, "supports_fusion": false, "supports_partition": false, "supports_sequence": false},
      "color_energy_range": ["high"], "data_capabilities": [],
      "editable_regions": ["chapter number", "large title", "subtitle"], "fixed_regions": ["two native diffuse color fields", "page number"],
      "renderer_requirements": ["preserve full-field color continuity", "do not treat diffuse ellipses as evidence"],